speaker_name,party,language,mep_id,role,text,translated_text
Bas | Eickhout,Verts/ALE,EN,96725,On behalf of the Group,"Mr President, Commissioner, Minister, let's be very clear. The illegal tariffs that are imposed and announced by the Trump administration will not only hurt Europeans, they will also hurt US consumers and businesses. Trump is playing a stupid but dangerous game. If the current negotiations do not work – and the Commissioner already said it – the EU has to show its strength and retaliate firmly. We have the instruments to do so. It comes down to political will and leadership. We should not back down to a bully. Important in our reaction is solidarity amongst EU Member States, because it's key. We will have to stay united, and therefore the money raised by countermeasures should be invested to support the affected sectors in all countries, in order to keep the unity. However, we have to be smarter than just bashing Trump on his favourite words. We need to develop a strategy that will make Europe stronger and more resilient in the new, chaotic world we are living in; a strategy that should build on the Green Deal that we have put in as a forward-looking and future-oriented strategy. But, on top of that, we need to have three principles in mind. First, we need to build European. We are overly dependent on US energy, defence, financial and digital services. Only strong and common European alternatives can provide us the operating room we need. We need joint investments in those sectors. We need joint EU borrowing measures. Secondly, we need to buy European. In the past months, the European consumers showed the way in showing how you do not buy further Teslas. We should learn from them and use local content requirements and resilience criteria, and give preference to European products and services. Thirdly, we need to protect European – our values, our industry. They will only survive if we act and protect, if we apply our digital rights to the letter, if we stop dumping on the EU market. We will work together with those that still value our rules-based system. Let that be our strategy. Build European, buy European, protect European. Europe needs to stop thinking as a market and start acting as a power – a power to do good.","Mr President, Commissioner, Minister, let's be very clear. The illegal tariffs that are imposed and announced by the Trump administration will not only hurt Europeans, they will also hurt US consumers and businesses. Trump is playing a stupid but dangerous game. If the current negotiations do not work – and the Commissioner already said it – the EU has to show its strength and retaliate firmly. We have the instruments to do so. It comes down to political will and leadership. We should not back down to a bully. Important in our reaction is solidarity amongst EU Member States, because it's key. We will have to stay united, and therefore the money raised by countermeasures should be invested to support the affected sectors in all countries, in order to keep the unity. However, we have to be smarter than just bashing Trump on his favourite words. We need to develop a strategy that will make Europe stronger and more resilient in the new, chaotic world we are living in; a strategy that should build on the Green Deal that we have put in as a forward-looking and future-oriented strategy. But, on top of that, we need to have three principles in mind. First, we need to build European. We are overly dependent on US energy, defence, financial and digital services. Only strong and common European alternatives can provide us the operating room we need. We need joint investments in those sectors. We need joint EU borrowing measures. Secondly, we need to buy European. In the past months, the European consumers showed the way in showing how you do not buy further Teslas. We should learn from them and use local content requirements and resilience criteria, and give preference to European products and services. Thirdly, we need to protect European – our values, our industry. They will only survive if we act and protect, if we apply our digital rights to the letter, if we stop dumping on the EU market. We will work together with those that still value our rules-based system. Let that be our strategy. Build European, buy European, protect European. Europe needs to stop thinking as a market and start acting as a power – a power to do good."
Martin | Schirdewan,The Left,DE,190517,On behalf of the Group,"Herr Präsident! Donald Trump hat es geschafft, in den ersten hundert Tagen seiner Präsidentschaft die internationalen Handelsbeziehungen komplett zu chaotisieren. Die Folgen für Wirtschaft und die Bevölkerung sind bereits absehbar. Die Wirtschaftsleistung wird zurückgehen, und gleichzeitig werden sich die Preise verteuern. Die Zeche dafür werden zuallererst wieder die arbeitende Bevölkerung zahlen und diejenigen, die sowieso wenig Geld in der Tasche haben. Diese Politik ist kein Zufall. Der Rechtspopulist Donald Trump versucht gezielt, die Interessen seiner Wirtschaftskumpels, nämlich der US‑Rüstungsindustrie, der US‑Energieriesen und der US‑Big‑Tech‑Unternehmen durchzusetzen. Aber die Europäische Kommission scheint das noch gar nicht wirklich begriffen zu haben. Herr Kommissar, wir befinden uns in einem globalen Handelskrieg, und dabei wird Handelspolitik als eine Waffe eingesetzt, um wirtschaftliche Interessen durchzusetzen und international Einflusssphären abzustecken. Dem muss europäische Politik mit einer klaren Strategie begegnen, die Wirtschaft und Jobs hier in der Europäischen Union schützt, und das geht nur mit massiven Investitionen in unsere Industrie. Das geht nur mit strategischer Unabhängigkeit der Europäischen Union. Heute wissen auch Sie, Herr Kommissar, dass die anfängliche Kopf‑in‑den‑Sand‑Strategie der Kommission à la „Es wird schon nicht so schlimm werden” politische Realitätsverweigerung war. Jetzt wollen Sie verhandeln, einen Deal auch im Sinne von Donald Trump abschließen, und wenn das nicht klappen sollte, dann soll es angeblich harte Gegenmaßnahmen geben. Von Angeboten Ihrerseits höre ich viel, die gibt es reichlich. Jetzt soll sogar noch mehr US‑Fracking-Gas gekauft werden – anstatt die europäische Energieunabhängigkeit voranzutreiben und so viele Jobs zu schaffen, wird eine neue Abhängigkeit von fossilen Energieträgern geschaffen. Das ist ökonomisch, sozial und ökologisch grundfalsch. Aber von dem Druck auf die US‑Regierung ist noch nichts zu sehen. Wo bleibt denn die Einführung des Instruments gegen Zwangsmaßnahmen? Wo bleibt denn die harte Regulierung der großen Big‑Tech‑Unternehmen? Wo bleibt die Einführung einer europäischen Digitalsteuer? Da machen Sie die Augen zu, da legen Sie die Hände hinter dem Rücken zusammen. Wollen Sie denn auf diese Art und Weise den reichsten Unternehmen und Menschen wie Elon Musk noch mehr Geld und vor allem auch unsere privaten Daten in den Rachen werfen? Es ist jetzt an der Zeit, mit Partnern wie Kanada, Mexiko, Japan, Südkorea, aber auch mit China an einer Handelsordnung zu wirken, die regelbasiert ist, auf fairem Handel statt auf entfesseltem Freihandel basiert. Und alles, was der EU‑Kommission da einzufallen scheint, sind Rohstoffabkommen wie das mit Ruanda, das maßgeblich zu einer Verschärfung des Krieges im Kongo beiträgt, oder digitale Kooperationsabkommen wie das mit Singapur, das unsere Datensicherheit unterläuft, oder aber klassische Freihandelsabkommen wie mit Mercosur, denen die Europäer schon seit TTIP die Rote Karte gezeigt haben, weil sie schlecht für soziale Standards, Umwelt und Landwirtschaft sind. Ihre Antwort auf Trump dient einzig und allein den US‑Oligarchen und den europäischen Oligarchen. Wir brauchen eine Antwort, die der Mehrheit der Bevölkerung und der Demokratie dient.","Mr President, Donald Trump has managed to completely chaotize international trade relations in the first hundred days of his presidency. The consequences for the economy and the population are already foreseeable. Economic output will fall and prices will rise at the same time. The bill for this will be paid first and foremost by the working population and those who already have little money in their pockets. This policy is no coincidence. The right-wing populist Donald Trump is deliberately trying to push through the interests of his economic cronies, namely the US arms industry, US energy giants and US big tech companies. But the European Commission doesn't really seem to have grasped this yet. Commissioner, we are in a global trade war, and trade policy is being used as a weapon to assert economic interests and stake out spheres of influence internationally. European policy must counter this with a clear strategy that protects the economy and jobs here in the European Union, and that is only possible with massive investment in our industry. This can only be achieved if the European Union is strategically independent. Today, Commissioner, you also know that the Commission's initial head-in-the-sand strategy of ""it won't be so bad"" was a political denial of reality. Now you want to negotiate, conclude a deal in the spirit of Donald Trump, and if that doesn't work, there are supposed to be tough countermeasures. I hear a lot about offers on your part, there are plenty of them. Now even more US fracking gas is to be bought - instead of driving forward European energy independence and creating so many jobs, a new dependency on fossil fuels is being created. This is economically, socially and ecologically fundamentally wrong. But there is still no sign of any pressure on the US government. Where is the introduction of the instrument against coercive measures? Where is the tough regulation of the big tech companies? Where is the introduction of a European digital tax? You are closing your eyes and putting your hands behind your back. Do you want to throw even more money and, above all, our private data down the throats of the richest companies and people like Elon Musk in this way? It is now time to work with partners such as Canada, Mexico, Japan, South Korea and China on a trade order that is rules-based and based on fair trade instead of unbridled free trade. And all the EU Commission seems to be able to come up with are commodity agreements such as the one with Rwanda, which contributes significantly to an intensification of the war in the Congo, or digital cooperation agreements such as the one with Singapore, which undermines our data security, or classic free trade agreements such as the one with Mercosur, which Europeans have already shown the red card to since TTIP because they are bad for social standards, the environment and agriculture. Their response to Trump serves only the US oligarchs and the European oligarchs. We need a response that serves the majority of the population and democracy."
René | Aust,ESN,DE,256929,On behalf of the Group,"Fraktion. – Herr Präsident, meine sehr geehrten Damen und Herren! Wer nach außen abhängig ist, wird nach außen handlungsunfähig. Und genau das ist eingetreten – nicht zufällig, sondern weil die Altparteien unsere militärische Sicherheit über Jahrzehnte den Vereinigten Staaten von Amerika überlassen haben. Das war bequem, aber es war auch naiv. Heute sehen wir das Ergebnis: Europa ist erpressbar geworden. Die Regierung unter Donald Trump versucht, Europa zum Kauf von immer mehr US‑Fracking‑Gas zu nötigen. Die Folge: noch höhere Energiepreise zulasten unserer Industrie, unserer Familien und unseres Wohlstandes. Und es rächt sich auch das überhebliche Gehabe, mit dem viele in der europäischen Politik über Jahre hinweg auf Donald Trump herabgesehen haben. Die öffentlichen Angriffe haben dazu geführt, dass heute weder in Brüssel noch in Berlin oder Paris vertrauensvolle Gesprächskanäle zur US‑Regierung bestehen. Ein Glück, dass es in Europa auch andere Stimmen gibt – Viktor Orbán, Georgia Meloni und viele patriotische Regierungen –, die den Kontakt gepflegt haben. Doch es geht nicht nur um Amerika. Auch Handelsalternativen wurden fahrlässig zerstört durch Besserwisserei gegenüber China, gegenüber Indien und weiten Teilen Afrikas. Statt Partnerschaft gab es Belehrungen über Demokratie, über Menschenrechte, über Klima. Und heute? Heute fehlen uns genau diese Partner als Alternativen, die wir bräuchten, um in Verhandlungen mit den USA Stärke zeigen zu können. Denn wer keine Alternativen hat, hat auch keine Verhandlungsmacht. Das europäische Establishment hat unseren Kontinent durch Arroganz isoliert. Doch wer im 21. Jahrhundert bestehen will, braucht Kooperation statt Konfrontation, Partnerschaften, nicht Feindbilder. Und noch etwas: Heute zeigt sich, wie wichtig der europäische Binnenmarkt ist. Zu diesem haben wir uns als AfD immer bekannt. Unser Motto lautet: Deutschland zuerst, aber nicht Deutschland allein. Europa muss in zentralen Handelsfragen mit einer Stimme sprechen. Aber das setzt auch eines voraus, nämlich: Das europäische Establishment muss die Spaltung nach innen beenden. Erkennen Sie das Wahlergebnis in Rumänien an! Hören Sie auf, sich aus Brüssel heraus in die inneren Angelegenheiten Ungarns einzumischen, und stoppen Sie die Verfolgung der AfD in Deutschland!","Group. - Mr President, ladies and gentlemen. Those who are dependent on the outside become incapable of acting on the outside. And that is exactly what has happened - not by chance, but because the old parties left our military security to the United States of America for decades. That was convenient, but it was also naive. Today we see the result: Europe has become vulnerable to blackmail. The government under Donald Trump is trying to force Europe to buy more and more US fracking gas. The result: even higher energy prices at the expense of our industry, our families and our prosperity. And the arrogant attitude with which many in European politics have looked down on Donald Trump over the years is also taking its revenge. The public attacks have meant that there are no trustworthy channels of communication with the US government today, neither in Brussels nor in Berlin or Paris. Fortunately, there are other voices in Europe - Viktor Orbán, Georgia Meloni and many patriotic governments - that have maintained contact. But it's not just about America. Trade alternatives have also been negligently destroyed by know-it-all attitudes towards China, India and large parts of Africa. Instead of partnership, there were lectures on democracy, human rights and the climate. And today? Today, we lack precisely these partners as alternatives that we need in order to show strength in negotiations with the USA. Because if you have no alternatives, you have no negotiating power. The European establishment has isolated our continent through arrogance. But if you want to survive in the 21st century, you need cooperation instead of confrontation, partnerships, not enemy stereotypes. And one more thing: today it is clear how important the European single market is. As the AfD, we have always been committed to this. Our motto is: Germany first, but not Germany alone. Europe must speak with one voice on key trade issues. But this also requires one thing: the European establishment must end the internal division. Recognize the election result in Romania! Stop interfering in Hungary's internal affairs from Brussels and stop the persecution of the AfD in Germany!"
Predsedajúci,NULL,SK,197770,,"A nakoľko nám skončilo prvé kolo vystupujúcich za politické skupiny a otvárame blue card. I would also like to inform you that I will have to be more strict as regards the usual courtesy of giving a bit more speaking time, with more tolerance towards the speakers of the political groups. But now, due to the time, we will have to be a bit more strict.","And since we're out of the first round of speakers for political groups, we're opening the blue card. I would also like to inform you that I will have to be more strict as regards the usual courtesy of giving a bit more speaking time, with more tolerance towards the speakers of the political groups. But now, due to the time, we will have to be a bit more strict."
Michał | Szczerba,PPE,EN,257026,,"Mr President, Commissioner, Minister, colleagues, nowadays the world is getting increasingly less predictable. In my country, Poland, people are asking what happens next? Should we be afraid of Russian aggression? Are Europe's relations with the US on a crisis course? Will Europe be able to quickly boost its defence capabilities? The future of transatlantic relations depends on our current actions. This is exactly why we, as Europeans, are taking more responsibility for our security. To build defence potential requires a strong economy. The imposition of tariffs by the US on EU exports do not help. We see no justification for this. Mutual imposition of tariffs on our economies is not our shared interest. My statement as a standing rapporteur for the US is crystal clear: transatlantic cooperation is beneficial for both sides of the Atlantic. Whether we talk about security or economy, no other economies in the world are integrated in such an advanced way. The EU and the US are the largest trade and investment partners. Together, we represent 30 % of global trade in goods and services. Therefore, the trade wars will not benefit either side. That is why we cannot stop engaging in building strong dialogue. But let me be clear here: the imposition of tariffs will not only hurt Europeans, American businesses will be affected too.","Mr President, Commissioner, Minister, colleagues, nowadays the world is getting increasingly less predictable. In my country, Poland, people are asking what happens next? Should we be afraid of Russian aggression? Are Europe's relations with the US on a crisis course? Will Europe be able to quickly boost its defence capabilities? The future of transatlantic relations depends on our current actions. This is exactly why we, as Europeans, are taking more responsibility for our security. To build defence potential requires a strong economy. The imposition of tariffs by the US on EU exports do not help. We see no justification for this. Mutual imposition of tariffs on our economies is not our shared interest. My statement as a standing rapporteur for the US is crystal clear: transatlantic cooperation is beneficial for both sides of the Atlantic. Whether we talk about security or economy, no other economies in the world are integrated in such an advanced way. The EU and the US are the largest trade and investment partners. Together, we represent 30 % of global trade in goods and services. Therefore, the trade wars will not benefit either side. That is why we cannot stop engaging in building strong dialogue. But let me be clear here: the imposition of tariffs will not only hurt Europeans, American businesses will be affected too."
Kathleen | Van Brempt,S-D,EN,5729,,"Mr President, dear Commissioner, colleagues, the US, once the greatest defender of liberal democracy, is rapidly becoming an authoritarian regime. This is a huge challenge, but also an opportunity for the European Union. It is time to show our strength. That is why we should support the WTO and intensify our contacts and trade with like-minded countries like the UK and Canada, and look for new sustainable partnerships in Asia and Latin America. And, of course, we need to negotiate, but not at all costs. Dear Commissioner, can you guarantee that our legislation is not up for discussion with the US? And why are the tariffs on US services still not yet on the table? I think we need answers to that. Above all, dear colleagues, the 'Trump show' should not distract us from doing what is needed for Europe. That means providing support for workers, implementing the Green Deal and investing in our strategic economy. Because the world, dear colleagues, needs urgently a united and independent Europe to lead the way.","Mr President, dear Commissioner, colleagues, the US, once the greatest defender of liberal democracy, is rapidly becoming an authoritarian regime. This is a huge challenge, but also an opportunity for the European Union. It is time to show our strength. That is why we should support the WTO and intensify our contacts and trade with like-minded countries like the UK and Canada, and look for new sustainable partnerships in Asia and Latin America. And, of course, we need to negotiate, but not at all costs. Dear Commissioner, can you guarantee that our legislation is not up for discussion with the US? And why are the tariffs on US services still not yet on the table? I think we need answers to that. Above all, dear colleagues, the 'Trump show' should not distract us from doing what is needed for Europe. That means providing support for workers, implementing the Green Deal and investing in our strategic economy. Because the world, dear colleagues, needs urgently a united and independent Europe to lead the way."
Jorge | Buxadé Villalba,PfE,ES,197829,,"Señor presidente, esto no va de aranceles ni de barreras comerciales. Esto va de a quién le colocan el muerto de la economía europea. No es cierto que vivamos en un régimen internacional de libre comercio que está en peligro. Los aranceles, las cuotas a la importación y las barreras regulatorias son la regla general. China subió los aranceles al porcino hace unos meses y ustedes no dijeron ni pío. Es Bruselas la que lleva décadas levantando barreras y cargas contra nuestros productores en nombre de la Pachamama. Competimos con las manos atadas mientras China, Turquía y Marruecos golpean con los dos puños. Y ustedes, socialistas y populares, son los responsables. Le niegan agua a Almería o Murcia, pero financian obras hídricas en Marruecos. Ustedes expropian cientos de miles de olivos en España para poner placas solares, ustedes prohíben a la industria vender coches con motores de combustión en 2035. Ustedes montaron un negocio especulativo de derechos de emisión de CO2 que ahoga a nuestras industrias por razones climáticas y un mecanismo de ajuste en frontera que es una barrera no arancelaria. Ustedes se meten en los consejos de administración debajo de las mesas a mirar el sexo de los administradores. Ustedes solo piensan en subir impuestos para pagar la juerga de las élites y se han gastado nuestro dinero en renovables chinas. Y en España ya no tenemos luz. Para ustedes, el libre comercio es rendirse con China. Para ustedes, libre comercio son esos acuerdos con países que no cumplen los estándares que se exigen a los nuestros. Por supuesto que rechazamos cualquier arancel a nuestros productores, pero primero y por encima de todo, rechazamos su Agenda 2030, su Pacto Verde y su hipocresía de fanáticos climáticos.","Mr. President, this is not about tariffs or trade barriers. This is about who gets the chopping block of the European economy. It is not true that we live in an endangered international free trade regime. Tariffs, import quotas and regulatory barriers are the general rule. China raised tariffs on pork a few months ago and you didn't say a peep. It is Brussels that has been raising barriers and burdens against our producers for decades in the name of Pachamama. We compete with our hands tied while China, Turkey and Morocco strike with both fists. And you, socialists and popular, are responsible. You deny water to Almeria or Murcia, but you finance water works in Morocco. You expropriate hundreds of thousands of olive trees in Spain to put solar panels, you prohibit the industry to sell cars with combustion engines in 2035. You set up a speculative business of CO2 emission rights that stifles our industries for climate reasons and a border adjustment mechanism that is a non-tariff barrier. You go under the board of directors' tables to look at the sex of the administrators. You only think about raising taxes to pay for the revelry of the elites and you have spent our money on Chinese renewables. And in Spain we no longer have electricity. For you, free trade means giving in to China. For you, free trade is those agreements with countries that do not meet the standards required of ours. Of course we reject any tariffs on our producers, but first and foremost, we reject your Agenda 2030, your Green Pact and your hypocrisy of climate fanatics."
