speaker_name,party,language,mep_id,role,text,translated_text
Predsedajúci,NULL,SK,197770,,Ďalším bodom programu je vyhlásenie Rady a Komisie: Jednotná reakcia Európskej únie na neodôvodnené obchodné opatrenia USA a globálne obchodné príležitosti pre Európsku úniu (2025/2657(RSP)).,The next item is the statement by the Council and the Commission: A united European Union response to unjustified US trade measures and global trade opportunities for the European Union (2025/2657(RSP)).
Adam | Szłapka,NULL,EN,0,President-in-Office of the Council,"in-Office of the Council. – Mr President, honourable Members, Commissioner, the EU-US trade and investment partnership is the most valuable in the world. I am convinced that we have a shared interest in protecting this mutually beneficial partnership and working together on common challenges. In this context, we deeply regret the recent increases of US tariffs applied on a very broad range of EU goods. We think that the imposition of additional tariffs, both universal and sectoral ones, is unjustified and arbitrary. These tariffs are damaging for prosperity. They negatively impact economic growth, foremost in the US but also globally, as confirmed by the IMF and WTO in their latest forecasts. Tariffs are taxes paid by businesses and ultimately by consumers. They will raise the cost of imports, disrupt supply chains and force companies to either absorb the cost or pass them on through higher prices, building up inflation. We welcome the 90-day suspension of a portion of the recently imposed US universal tariffs. At the same time, we are deeply concerned by many tariff increases remaining in place and possible new tariffs. More importantly, we are very concerned by the uncertainty that the US Administration announcements brought to the global economy. We understand that the US seeks to strengthen the resilience of its domestic industrial base and to enhance its economic security, but we believe that the announced tariffs are not the right way to achieve these goals. On behalf of the Council, I can assure you that we are united in our readiness to engage in a constructive dialogue with the US. Our priority is clearly to agree on a solution that is balanced and mutually beneficial, and that brings about more predictable trade and investment conditions. We believe that there is sufficient scope for delivering such a solution, but it is clear that significant joint efforts will still be needed to get there. We welcome recent concrete steps made by the Commission in the form of an offer of negotiations in selected areas. This step has full backing from the Council. As a clear sign of our good faith and our restraint, we have temporarily suspended the first set of countermeasures. It is also a sign of us not wishing to add to the already an unprecedented levels of economic uncertainty. But let me be clear: we will defend our legitimate interests and rights if we have to, and we will do so in a united, targeted and measured manner. There is a broad agreement in the Council on the need to work on possible further countermeasures, which would complement those already adopted. Our countermeasures can be fully reversed at any time if a negotiated solution is found. If, however, negotiation failed to deliver the desired outcome, we will consider taking further steps, keeping all options on the table, including a WTO complaint. We are working closely with the Commission. We are carefully assessing not only the effects of new US tariffs on EU exports, but also monitoring any unwanted indirect effects. We simply cannot absorb global overcapacity, we cannot accept dumping on our markets. Mr President, honourable Members, Commissioner, in these challenging times, we remain committed to the rules-based international order, as we continue to believe in an open and predictable global trading system that benefits all partners. We are engaging with our international partners both through multilateral fora as well as bilaterally. That is why the issue of possible trade diversion is firmly on our radar screen. In the Council, there is a broad agreement on the importance of deepening our existing partnerships around the world, as well as sealing new win-win deals. Finally, I want to underline that in times of growing uncertainty, the single market stands as a vital source of stability and resilience. The new situation we are facing gives an additional sense of urgency in implementing the new European competitiveness deal. We will therefore be stepping up our work in the Council towards lifting the remaining barriers to the proper functioning of our single market and boosting its potential.","in-Office of the Council. – Mr President, honourable Members, Commissioner, the EU-US trade and investment partnership is the most valuable in the world. I am convinced that we have a shared interest in protecting this mutually beneficial partnership and working together on common challenges. In this context, we deeply regret the recent increases of US tariffs applied on a very broad range of EU goods. We think that the imposition of additional tariffs, both universal and sectoral ones, is unjustified and arbitrary. These tariffs are damaging for prosperity. They negatively impact economic growth, foremost in the US but also globally, as confirmed by the IMF and WTO in their latest forecasts. Tariffs are taxes paid by businesses and ultimately by consumers. They will raise the cost of imports, disrupt supply chains and force companies to either absorb the cost or pass them on through higher prices, building up inflation. We welcome the 90-day suspension of a portion of the recently imposed US universal tariffs. At the same time, we are deeply concerned by many tariff increases remaining in place and possible new tariffs. More importantly, we are very concerned by the uncertainty that the US Administration announcements brought to the global economy. We understand that the US seeks to strengthen the resilience of its domestic industrial base and to enhance its economic security, but we believe that the announced tariffs are not the right way to achieve these goals. On behalf of the Council, I can assure you that we are united in our readiness to engage in a constructive dialogue with the US. Our priority is clearly to agree on a solution that is balanced and mutually beneficial, and that brings about more predictable trade and investment conditions. We believe that there is sufficient scope for delivering such a solution, but it is clear that significant joint efforts will still be needed to get there. We welcome recent concrete steps made by the Commission in the form of an offer of negotiations in selected areas. This step has full backing from the Council. As a clear sign of our good faith and our restraint, we have temporarily suspended the first set of countermeasures. It is also a sign of us not wishing to add to the already an unprecedented levels of economic uncertainty. But let me be clear: we will defend our legitimate interests and rights if we have to, and we will do so in a united, targeted and measured manner. There is a broad agreement in the Council on the need to work on possible further countermeasures, which would complement those already adopted. Our countermeasures can be fully reversed at any time if a negotiated solution is found. If, however, negotiation failed to deliver the desired outcome, we will consider taking further steps, keeping all options on the table, including a WTO complaint. We are working closely with the Commission. We are carefully assessing not only the effects of new US tariffs on EU exports, but also monitoring any unwanted indirect effects. We simply cannot absorb global overcapacity, we cannot accept dumping on our markets. Mr President, honourable Members, Commissioner, in these challenging times, we remain committed to the rules-based international order, as we continue to believe in an open and predictable global trading system that benefits all partners. We are engaging with our international partners both through multilateral fora as well as bilaterally. That is why the issue of possible trade diversion is firmly on our radar screen. In the Council, there is a broad agreement on the importance of deepening our existing partnerships around the world, as well as sealing new win-win deals. Finally, I want to underline that in times of growing uncertainty, the single market stands as a vital source of stability and resilience. The new situation we are facing gives an additional sense of urgency in implementing the new European competitiveness deal. We will therefore be stepping up our work in the Council towards lifting the remaining barriers to the proper functioning of our single market and boosting its potential."
