speaker_name,party,language,mep_id,role,text,translated_text
Virginijus | Sinkevičius,Verts/ALE,EN,201945,,"Mr President, dear Minister, dear Commissioner, dear colleagues, the recent US tariffs don't just hit our exports, they strike at the heart of what should be a fair and trusted partnership. Over EUR 500 billion-worth of EU goods could be affected. Behind that figure, there are real people – our workers, our businesses and the values that we stand for – and the only correct response is with unity, with calm and with purpose. Yes, we have introduced proportionate countermeasures, but we are also keeping the door wide open for a dialogue, for an honest dialogue, offering to boost imports of US goods by EUR 50 billion to help restore balance. Still, this is much more than just a dispute. It's about Europe shaping its own path – building stronger, more diverse partnerships and standing up for a global trade system based on rules and mutual respect. Across Europe, people also reacted. People are frustrated. Boycotts and anti-American sentiment are rising. But our message is clear. We want solutions, not a trade war. If the US is ready to negotiate, so are we. If not, Europe will stand tall, united, and turn this challenge into an opportunity.","Mr President, dear Minister, dear Commissioner, dear colleagues, the recent US tariffs don't just hit our exports, they strike at the heart of what should be a fair and trusted partnership. Over EUR 500 billion-worth of EU goods could be affected. Behind that figure, there are real people – our workers, our businesses and the values that we stand for – and the only correct response is with unity, with calm and with purpose. Yes, we have introduced proportionate countermeasures, but we are also keeping the door wide open for a dialogue, for an honest dialogue, offering to boost imports of US goods by EUR 50 billion to help restore balance. Still, this is much more than just a dispute. It's about Europe shaping its own path – building stronger, more diverse partnerships and standing up for a global trade system based on rules and mutual respect. Across Europe, people also reacted. People are frustrated. Boycotts and anti-American sentiment are rising. But our message is clear. We want solutions, not a trade war. If the US is ready to negotiate, so are we. If not, Europe will stand tall, united, and turn this challenge into an opportunity."
Pasquale | Tridico,The Left,IT,257133,,"Signor Presidente, signor Commissario, onorevoli colleghi, la politica commerciale di Trump rispolvera la logica mercantilista secondo cui un disavanzo commerciale rappresenterebbe una minaccia. Nel 2023 gli Stati Uniti hanno importato dall'Unione europea beni per circa 157 miliardi di euro. Però dobbiamo allargare lo sguardo ai servizi e qui notiamo che sono gli Stati Uniti ad avere un surplus di 109 miliardi. Questo ci ricorda di quanto le relazioni economiche siano complesse e vadano lette nel loro insieme. Oggi i dazi sono sospesi ma le tensioni restano e intanto molte grandi aziende statunitensi, in particolare nel digitale, continuano a fare profitti esorbitanti. È una questione di giustizia: dobbiamo mettere riparo a questa situazione. Per questo serve una tassa sui servizi digitali. Inoltre l'Unione europea dovrebbe allargare i suoi legami commerciali con altri paesi emergenti, i BRICS, e non dipendere dalle scelte unilaterali di Trump. Non dimentichiamoci le ricadute economiche dei dazi, la recessione. Per questo dobbiamo puntare anche sulla crescita dei salari, sulla domanda interna e sui consumi. L'Europa deve vincere le sfide con maggiore forza nei confronti del potente di turno a Washington.","Mr. President, Commissioner, ladies and gentlemen, Trump's trade policy dusts off the mercantilist logic that a trade deficit poses a threat. In 2023, the United States imported about 157 billion euros worth of goods from the European Union. However, we have to widen the look to services, and here we note that it is the United States that has a surplus of 109 billion. This reminds us of how complex economic relations are and must be read as a whole. Today the tariffs are suspended but tensions remain and meanwhile many large U.S. companies, particularly in digital, continue to make exorbitant profits. This is a matter of justice: we need to remedy this situation. That's why we need a tax on digital services. In addition, the European Union should expand its trade ties with other emerging countries, the BRICS, and not depend on Trump's unilateral choices. Let's not forget the economic fallout of tariffs, recession. So we must also focus on wage growth, domestic demand and consumption. Europe must win the challenges more forcefully against the powerful in Washington."
Željana | Zovko,PPE,EN,185341,,"Mr President, dear colleagues, war begins in the minds of the people, and it's in their minds that peace is also created. For decades, we relied heavily on American partners, and we still do for our defence and defence of our trade routes, at least in the Red Sea. But with unjustified imposition of tariffs, it has become clear we must take matters in our own hands and strengthen our competitiveness. We need to simplify it and we need to work and to attract investments. We now have a 90-day tariff pause. This is not the time to wait. It's a window of opportunity, a chance to negotiate the best possible outcome for both sides of the Atlantic; an outcome that allows business to thrive, to support millions of jobs; an outcome that strengthens, not harms, our economies; one that reinforces the largest trading partnership in the world. In an era of free trade and the rules-based global order, there is no room for protectionism. Protectionism comes at a cost, a cost that must not be borne by any single industry or country alone. A change in US administration should not mean a change in the fundamental strength of our transatlantic relationship. One thing must remain clear: the United States has always been and will remain our strongest partner and ally, not one-party regimes or autocracies. The European Union must continue with the calm logic that has made us the strongest single market in the world – the logic that allows small fish to survive in turbulent waters where large fish prey. (The speaker agreed to take a blue-card question)","Mr President, dear colleagues, war begins in the minds of the people, and it's in their minds that peace is also created. For decades, we relied heavily on American partners, and we still do for our defence and defence of our trade routes, at least in the Red Sea. But with unjustified imposition of tariffs, it has become clear we must take matters in our own hands and strengthen our competitiveness. We need to simplify it and we need to work and to attract investments. We now have a 90-day tariff pause. This is not the time to wait. It's a window of opportunity, a chance to negotiate the best possible outcome for both sides of the Atlantic; an outcome that allows business to thrive, to support millions of jobs; an outcome that strengthens, not harms, our economies; one that reinforces the largest trading partnership in the world. In an era of free trade and the rules-based global order, there is no room for protectionism. Protectionism comes at a cost, a cost that must not be borne by any single industry or country alone. A change in US administration should not mean a change in the fundamental strength of our transatlantic relationship. One thing must remain clear: the United States has always been and will remain our strongest partner and ally, not one-party regimes or autocracies. The European Union must continue with the calm logic that has made us the strongest single market in the world – the logic that allows small fish to survive in turbulent waters where large fish prey. (The speaker agreed to take a blue-card question)"
Petras | Gražulis,ESN,LT,256808,,"Kaip čia ir kalbėjo kolegos, Briuselis ir ne tik Briuselis per prezidento rinkimus aktyviai palaikė demokratų kandidatą ir žemino trumpą. Dabar taip pat Europos Sąjunga labiau negu Putiną žemina Trumpą ... (posėdžio pirmininkas nutraukė ir paprašė pradėti iš naujo). Gerbiama pranešėja, čia kalbėjo prieš tai kandidatai, diskutantai, kad Europos Sąjunga ir Briuselis per prezidento rinkimus Amerikoje palaikė demokratų kandidatą. Iš Trumpo nemažai tyčiojosi. Išrinktas prezidentas Trumpas dabar taip pat susilaukia nemažai patyčių iš Europos Sąjungos, net ir vadovų, ypač iš žiniasklaidos. Jis tapo skaitant žiniasklaidą pavojingesnis negu Putinas. Klausykit, ar jūs nežadate atsiprašyti Trumpo ir Amerikos? Ir tik tokiu atveju prasidės normalūs santykiai. Ką jūs galvojate?","As colleagues here have said, Brussels and not only Brussels actively supported the Democratic candidate in the presidential elections and humiliated Trump. Now, too, the European Union is humiliating Trump more than Putin ... (the President interrupted and asked to start again). Madam President, it has been said here by the candidates who have spoken before, by the debaters, that the European Union and Brussels supported the Democratic candidate in the American presidential elections. There was a lot of mockery of Trump. President-elect Trump is now also receiving a lot of bullying from the European Union, even from the leaders, especially from the media. He has become more dangerous than Putin in terms of reading the media. Listen, are you not promising to apologise to Trump and to America? And only then will normal relations begin. What do you think?"
Željana | Zovko,PPE,EN,185341,,"card answer. – As a politician, I could just say that every politician and everyone in this House has responsibility for the words they say. So, I never insulted anyone. It's not mine to speak on behalf of other politicians. Democratic words should be preserved to build peace, and not war with words. This was the beginning of my speech as well. So, I stick to the logic that there is no place for insults in politics.","card answer. – As a politician, I could just say that every politician and everyone in this House has responsibility for the words they say. So, I never insulted anyone. It's not mine to speak on behalf of other politicians. Democratic words should be preserved to build peace, and not war with words. This was the beginning of my speech as well. So, I stick to the logic that there is no place for insults in politics."
Γιάννης | Μανιάτης,S-D,EL,256824,,"Κύριε Πρόεδρε, η απόφαση Trump για επιβολή δασμών 20% σε ευρωπαϊκά προϊόντα και ο εμπορικός πόλεμος ανταλλαγών ύψους ενός τρισεκατομμυρίου ευρώ θα επηρεάσουν αρνητικά τόσο την Ευρώπη όσο και τις Ηνωμένες Πολιτείες. Παρά την αναβολή τους μέχρι τον Ιούλιο, έχουν ήδη αρχίσει να εφαρμόζονται δασμοί ύψους 10%, ενώ παραμένουν οι δασμοί 25% σε αλουμίνιο, χάλυβα και αυτοκίνητα. Η Ευρωπαϊκή Ένωση θα πρέπει να αξιοποιήσει το διάστημα μέχρι τον Ιούλιο, ώστε να διαπραγματευτεί μια συμφωνία που θα αντιμετωπίζει όλα τα εμπορικά εμπόδια και από τις δύο πλευρές του Ατλαντικού. Την ίδια στιγμή, όμως, θα πρέπει να ετοιμαζόμαστε και για το ενδεχόμενο να μην υπάρξει συμφωνία. Σε αυτή την περίπτωση, πρέπει ενωμένοι οι Ευρωπαίοι να αποφασίσουμε για μια σειρά από αντίμετρα. Επιπλέον, απαιτούνται μέτρα οικονομικής ενίσχυσης των παραγωγών μας που πλήττονται από τους δασμούς, ιδιαίτερα στον αγροδιατροφικό τομέα —για παράδειγμα, στην Ελλάδα, των παραγωγών επιτραπέζιας ελιάς και των παραγωγών ροδάκινου. Δεν πρέπει να αφήσουμε τους παραγωγούς και τη βιομηχανία μας να πληρώσουν το τίμημα ενός παράλογου εμπορικού πολέμου.","Mr President, Trump's decision to impose 20% tariffs on European products and the trillion euro trade war will negatively affect both Europe and the United States. Despite their postponement until July, 10% tariffs have already started to be applied, while 25% tariffs on aluminium, steel and cars remain. The European Union should use the time between now and July to negotiate an agreement that addresses all trade barriers on both sides of the Atlantic. At the same time, however, we should also prepare for the possibility of no deal. In that case, Europeans must unite to decide on a series of countermeasures. In addition, measures are needed to financially support our producers affected by the tariffs, particularly in the agri-food sector - for example, in Greece, table olive and peach producers. We must not let our producers and our industry pay the price of an unreasonable trade war."
Isabella | Tovaglieri,PfE,IT,197580,,"Signor Presidente, onorevoli colleghi, mentre l'Europa tratta sui dazi, i dazi sono già tra noi. E non li ha messi Trump: li avete messi voi in questi anni, quando avete tagliato le gambe alla manifattura, al commercio, all'agricoltura, con oneri burocratici che costano alle nostre imprese ogni anno 154 miliardi di euro, quindi molto più dei 100 miliardi di euro in cui sono stati stimati i futuribili dazi americani. Vi siete autoimposti i dazi anche quando avete varato miopi politiche ideologiche come il Green Deal, lo stop ai motori endotermici che stanno solo portando l'Europa alla desertificazione produttiva e alla disoccupazione, privando le famiglie del loro potere d'acquisto. Quindi, anziché puntare il dito contro quei leader che scelgono di fare l'interesse del proprio paese, prendete esempio e cancellate tutte quelle imposizioni che stanno portando l'Europa al suicidio industriale e geopolitico. Altrimenti i dazi sono l'ennesimo comodo capro espiatorio per coprire i fallimenti delle politiche autolesioniste, incapaci di dare un futuro all'Europa: il futuro che merita.","Mr. President, ladies and gentlemen, while Europe negotiates on tariffs, the tariffs are already among us. And Trump did not put them in: you put them in these years, when you cut the legs out from under manufacturing, trade, agriculture, with bureaucratic burdens that cost our businesses 154 billion euros every year, so much more than the 100 billion euros in which the futuristic U.S. duties have been estimated. You have also self-imposed duties when you have enacted short-sighted ideological policies such as the Green Deal, the stop to endothermic engines that are only leading Europe to productive desertification and unemployment, depriving families of their purchasing power. So instead of pointing fingers at those leaders who choose to do their country's best interest, take an example and cancel all those impositions that are leading Europe to industrial and geopolitical suicide. Otherwise, tariffs are yet another convenient scapegoat to cover up the failures of self-defeating policies incapable of giving Europe a future: the future it deserves."
Rihards | Kols,ECR,EN,220871,,"Mr President, dear colleagues, the US tariffs are harsh, but they remind us how critical it is to deepen, not weaken, our transatlantic bond. In a world of fast-moving competition, while we debate, others – especially authoritarian regimes – are moving fast to dominate emerging technologies and critical raw materials. This is the time to align. We need permanent EU trade representation not just in Washington but in the wider US, to identify, negotiate and remove the barriers that still hold back transatlantic trade. But we must do so without compromising our standards: food, safety, security, etc. Targeted coordination on critical sectors and technologies is what we should be locking in on. That includes improving customs processing, eliminating red tape, and other measures that slow innovation on both sides of the Atlantic. And while I rarely quote Elon Musk, I'll agree with him on this: Europe and the US should aim for a 'zero-tariff zone'. So a stronger, freer trade relationship – rooted in trust and common democratic ground – is in both of our interests.","Mr President, dear colleagues, the US tariffs are harsh, but they remind us how critical it is to deepen, not weaken, our transatlantic bond. In a world of fast-moving competition, while we debate, others – especially authoritarian regimes – are moving fast to dominate emerging technologies and critical raw materials. This is the time to align. We need permanent EU trade representation not just in Washington but in the wider US, to identify, negotiate and remove the barriers that still hold back transatlantic trade. But we must do so without compromising our standards: food, safety, security, etc. Targeted coordination on critical sectors and technologies is what we should be locking in on. That includes improving customs processing, eliminating red tape, and other measures that slow innovation on both sides of the Atlantic. And while I rarely quote Elon Musk, I'll agree with him on this: Europe and the US should aim for a 'zero-tariff zone'. So a stronger, freer trade relationship – rooted in trust and common democratic ground – is in both of our interests."
Ľubica | Karvašová,Renew,SK,257013,,"Vážený pán predsedajúci, Trump Američanom odkázal, že na Vianoce bude menej hračiek a budú drahšie. To sú skvelé výsledky politiky ciel Donalda Trumpa. Politikov, čo mu fandia, ale máme aj v Európe a aj na Slovensku na čele s predsedom vlády Róbertom Ficom. Naši občania pritom budú trpieť najviac: v automobilkách, oceliarniach, v subdodávkach. Vláda sa má za naše firmy biť aj za našich občanov, a to spolu s Úniou. Nestačí zamestnancov poslať na kurzarbeit. A nepomôže ani cesta premiéra do Moskvy tento týždeň. Je dobré, že v Kanade aj v Austrálii vyhrali politici, ktorí veria vo férový obchod a nie v šikanu. Máme otvárať trhy, máme zlepšovať podnikateľské prostredie, máme lákať firmy a talenty do Európy. Ale áno, treba aj rokovať a trpezlivo rokovať so Spojenými štátmi. Ale aj my chceme spravodlivosť v obchode. Obrovskí digitálni obri a giganty v Európe zarábajú miliardy eur. Je to fér? Ak sa nedohodneme so Spojenými štátmi, Komisia musí konať a my budeme jej partnermi.","Mr President, Mr Trump has told the American people that there will be fewer toys and they will be more expensive at Christmas. These are the great results of Donald Trump's tariffs policy. However, we also have politicians cheering him on in Europe and also in Slovakia, led by Prime Minister Róbert Fico. Our citizens will suffer the most: in the car factories, in the steel mills, in subcontracting. The government is supposed to fight for our companies and our citizens, together with the Union. It is not enough to send employees to coursework. Nor will the Prime Minister's trip to Moscow this week help. It is good that in both Canada and Australia, politicians who believe in fair trade and not bullying have won. We are supposed to open markets, we are supposed to improve the business environment, we are supposed to attract companies and talent to Europe. But, yes, we also need to negotiate and negotiate patiently with the United States. But we also want fairness in trade. The huge digital giants and giants in Europe are making billions of euros. Is that fair? If we do not reach an agreement with the United States, the Commission must act and we will be its partners."
Vicent | Marzà Ibáñez,Verts/ALE,ES,257016,,"Señor presidente, señor comisario, las políticas arancelarias de Trump no son una guerra comercial. Son, sobre todo, un ataque a nuestros valores y a nuestra democracia. Es una lucha entre la oligarquía y los demócratas. Lo hemos visto en dos episodios recientemente. Primero, se ha hecho patente con el rechazo a la propuesta del comisario de generar un espacio de cero aranceles entre Europa y Estados Unidos, así como con el rechazo a la visita del ministro español de Economía, que terminó con una crítica directa a los impuestos que tenemos en la Unión Europea, una crítica directa a nuestra protección social, medioambiental y laboral. Por eso le pedimos, señor comisario, que no ceda al chantaje, que refuerce a nuestros trabajadores y trabajadoras y nuestra economía, que refuerce nuestra legislación medioambiental y ―sobre todo― que deje de pactar con el caballo de Troya de la Administración Trump aquí en Europa, que es la extrema derecha que nos quiere más débiles y más divididos. Por ello, le decimos alto y claro que no ceda al chantaje y que nuestros valores y nuestra democracia no están en venta.","Mr. Chairman, Commissioner, Trump's tariff policies are not a trade war. They are, above all, an attack on our values and our democracy. It is a fight between the oligarchy and the Democrats. We have seen this in two episodes recently. First, it has been made clear with the rejection of the Commissioner's proposal to generate a zero-tariff space between Europe and the United States, as well as with the rejection of the visit of the Spanish Minister of Economy, which ended with a direct criticism of the taxes we have in the European Union, a direct criticism of our social, environmental and labor protection. That is why we ask you, Commissioner, not to give in to blackmail, to strengthen our workers and our economy, to strengthen our environmental legislation and -above all- to stop making pacts with the Trojan horse of the Trump Administration here in Europe, which is the extreme right that wants us weaker and more divided. Therefore, we tell him loud and clear that he should not give in to blackmail and that our values and our democracy are not for sale."
Li | Andersson,The Left,EN,256805,,"Mr President, the US is ruled by an authoritarian president who is using trade policies as a means of coercion and political extortion. While it is clear that European workers will only lose in a full-fledged trade war, the EU should be much bolder and much more imaginative in its own response to Trump's actions. The EU should target the oligarchs that are close to Trump, through action directed at Tesla and Musk, and by digital tax aimed at the huge digital platforms. The EU should also signal its readiness to use the Anti-Coercion Instrument. But most importantly, we need to make the European economy less dependent on US exports. That means supporting internal demand in the European markets, and that means supporting real wage growth and also increasing investments. More than ever, we need to put people and workers first in our economic policymaking.","Mr President, the US is ruled by an authoritarian president who is using trade policies as a means of coercion and political extortion. While it is clear that European workers will only lose in a full-fledged trade war, the EU should be much bolder and much more imaginative in its own response to Trump's actions. The EU should target the oligarchs that are close to Trump, through action directed at Tesla and Musk, and by digital tax aimed at the huge digital platforms. The EU should also signal its readiness to use the Anti-Coercion Instrument. But most importantly, we need to make the European economy less dependent on US exports. That means supporting internal demand in the European markets, and that means supporting real wage growth and also increasing investments. More than ever, we need to put people and workers first in our economic policymaking."
