speaker_name,party,language,mep_id,role,text,translated_text
Evin | Incir,S-D,EN,197392,,"Mr President, to US President Trump: you are a loser. Because there are no winners in this trade war; it drives up prices, destroys jobs, stifles growth and hits the most vulnerable the hardest. It affects everyday people the hardest; Trump's heavy tariffs are disturbing supply chains and, in a few weeks, shelves in the US could be empty. And it polarises a world that already is facing many challenges with, among other things, Russia's unlawful attack on Ukraine. Trade barriers should be dismantled, not built. As the United States retreats from the global stage, turning its back on the very order it helped build after the Second World War, Europe must step up. We need an open world beyond Trump's ideology and the ideology of his extreme right-wing puppets in the EU. We need politics for the many, we need politics for the people. We must strengthen our relationship with other like-minded countries: Ukraine, Australia, Canada, Japan, India, Brazil, Mexico and many, many others. Through unity, we will ensure that today's craziness will also soon pass, and openness, cooperation and freedom will prevail.","Mr President, to US President Trump: you are a loser. Because there are no winners in this trade war; it drives up prices, destroys jobs, stifles growth and hits the most vulnerable the hardest. It affects everyday people the hardest; Trump's heavy tariffs are disturbing supply chains and, in a few weeks, shelves in the US could be empty. And it polarises a world that already is facing many challenges with, among other things, Russia's unlawful attack on Ukraine. Trade barriers should be dismantled, not built. As the United States retreats from the global stage, turning its back on the very order it helped build after the Second World War, Europe must step up. We need an open world beyond Trump's ideology and the ideology of his extreme right-wing puppets in the EU. We need politics for the many, we need politics for the people. We must strengthen our relationship with other like-minded countries: Ukraine, Australia, Canada, Japan, India, Brazil, Mexico and many, many others. Through unity, we will ensure that today's craziness will also soon pass, and openness, cooperation and freedom will prevail."
Francesco | Torselli,ECR,IT,257163,,"Signor Presidente, Signor Commissario, onorevoli colleghi, credo che la riflessione sulle relazioni commerciali fra Europa e Stati Uniti debba oggi svilupparsi su due differenti piani. Il primo, su cui penso e spero siamo tutti d'accordo, è che l'Unione europea debba dare una risposta univoca alle sollecitazioni che arrivano dall'altra sponda dell'Atlantico. Il secondo è che questa risposta non può essere solo il braccio di ferro, perché questo significherebbe mettere a repentaglio le nostre filiere produttive. Qualcuno in quest'Aula questa mattina ha parlato di sanzioni: ci rendiamo conto, Commissario, cosa significherebbe applicare delle sanzioni? Semmai a chi? L'Europa deve pensare invece alla diversificazione dei mercati, alla tutela dei produttori, allo scambio equo delle merci. E La lascio con una riflessione, caro Commissario: visitando aziende sul territorio, i nostri imprenditori non si dicono preoccupati soltanto per i dazi americani. Tutti ci chiedono di rivedere le folli decisioni prese in quest'Aula nella scorsa legislatura, che hanno imposto alle nostre imprese costi assurdi e standard irrealizzabili. Iniziamo col rimuovere questi dazi che l'Europa ha imposto a se stessa e andremo in una direzione migliore: abbiamo grande fiducia in Lei, Commissario.","Mr. President, Commissioner, ladies and gentlemen, I believe that the reflection on trade relations between Europe and the United States today should be developed on two different levels. The first, on which I think and I hope we all agree, is that the European Union has to give an unambiguous response to the solicitations coming from the other side of the Atlantic. The second is that this response cannot just be arm wrestling, because that would mean jeopardizing our production chains. Someone here this morning talked about sanctions: do we realize, Commissioner, what it would mean to apply sanctions? If anything, to whom? Instead, Europe must think about diversification of markets, protection of producers, fair trade of goods. And I leave you with a thought, dear Commissioner: visiting companies on the ground, our entrepreneurs say they are not only worried about U.S. tariffs. They are all asking us to review the crazy decisions made here in the last legislature, which imposed absurd costs and unworkable standards on our businesses. Let's start by removing these duties that Europe has imposed on itself and we will go in a better direction.We have great confidence in you, Commissioner."
Jüri | Ratas,PPE,ET,188096,,"Austatud president! Head ametikaaslased ja volinik! Euroopa Liidu ja Ameerika Ühendriikide kaubandussuhted on aastaid olnud meie tugevuse lahutamatu osa. Eelmisel aastal ulatus kahepoolne kaubavahetus muljetavaldava kaheksasaja kuuekümne viie miljardi euroni. Meid seovad ka ühised väärtused: demokraatia, õigusriik ja turumajandus. Võimalik tollitariifide kehtestamine ähvardab lüüa mõra meie koostööle. Segadust on hetkel veel üsna palju, kuid solvumine ja emotsioonid ei tohi praegu domineerida. Euroopa peab jääma ühtseks ja kindlaks. Eesti, väikese avatud majandusega riigi esindajana ütlen selgelt: me vajame reeglitel põhinevat kaubandust, mitte suva järgi seatud tollimüüre. Samas ei saa me lubada, et meie ettevõtted ja töötajad satuvad ebaõiglase surve alla. Toetan Euroopa Komisjoni püüdlusi leida parim lahendus läbirääkimiste teel. Samal ajal peame tugevdama oma siseturgu, vähendama strateegilisi sõltuvusi ja looma uusi rahvusvahelisi partnerlussuhteid.","Dear President. Colleagues and Commissioner, Trade relations between the European Union and the United States have been an integral part of our strength for many years. Last year, bilateral trade amounted to an impressive EUR eight hundred and sixty-five billion. We are also bound by common values: democracy, the rule of law and the market economy. The possible imposition of tariffs threatens to put a dent in our cooperation. There is still a great deal of confusion at the moment, but offence and emotion must not prevail. Europe must remain united and firm. As a representative of Estonia, a small open economy, I say clearly: we need rules-based trade, not arbitrary tariffs. At the same time, we cannot allow our businesses and workers to come under unfair pressure. I support the European Commission's efforts to find the best negotiated solution. At the same time, we need to strengthen our internal market, reduce strategic dependencies and build new international partnerships."
Andi | Cristea,S-D,RO,40224,,"Domnule președinte, stimați colegi, domnule comisar, avem în față un potențial drum periculos în ceea ce privește relațiile cu prietenii noștri americani. Aveam și avem această asimetrie structurală când vine vorba de principii, valori și interese. Nu mai suntem aliniați și lucrul ăsta este profund de periculos. Aceste tarife reprezintă expresia unei crize sociale profunde în Statele Unite, o criză socială, pentru că distribuția bogăției în Statele Unite este mai inegală decât distribuția bogăției înainte de Revoluția Franceză. Nu critic prietenii noștri americani pentru că suntem parteneri, dar prin tot ceea ce au făcut în ultimele decenii, aș spune că au prioritizat nu salariile și standardul de viață al celor care muncesc, ci au prioritizat creșterea capitalului celor care investesc, iar lucrul ăsta ar trebui să se schimbe pentru a avea liniște și un parteneriat transatlantic corespunzător.","Mr President, dear colleagues, Commissioner, we have a potentially dangerous road ahead of us in relations with our American friends. We had and have this structural asymmetry when it comes to principles, values and interests. We are no longer aligned and that is profoundly dangerous. These tariffs are the expression of a deep social crisis in the United States, a social crisis, because the distribution of wealth in the United States is more unequal than the distribution of wealth before the French Revolution. I am not criticizing our American friends because we are partners, but in everything they have done over the last decades, I would say that they have prioritized not the wages and living standards of those who work, but they have prioritized the capital growth of those who invest, and that should change in order to have peace and a proper transatlantic partnership."
Maria | Walsh,PPE,EN,197863,,"Mr President, the audiovisual industry is worth over EUR 1 billion to Ireland's economy. From actor Rob Lowe to Variety magazine, the world recognises our island as a global production powerhouse. Trump's latest threat to slap a 100 % tariff on foreign movies could wipe out our film industry in an instant. Over 16 000 jobs, many in rural Ireland, hang in the balance. A far cry from Hollywood's drama, the livelihoods of many of my constituents are in doubt as we sit here and debate this morning. Unsurprisingly, this latest policy seems unworkable; given the international and entwined web of investors, labour and revenue, how can one even define a foreign film in this day and age? As time has taught us, there is always scope for a rollback from the Trump administration. However, while we may hope for such courage, we cannot be complacent or naive. I'm calling on the Commission and our Member States to act with urgency and seek the answers from the US on the policy over the coming days and weeks.","Mr President, the audiovisual industry is worth over EUR 1 billion to Ireland's economy. From actor Rob Lowe to Variety magazine, the world recognises our island as a global production powerhouse. Trump's latest threat to slap a 100 % tariff on foreign movies could wipe out our film industry in an instant. Over 16 000 jobs, many in rural Ireland, hang in the balance. A far cry from Hollywood's drama, the livelihoods of many of my constituents are in doubt as we sit here and debate this morning. Unsurprisingly, this latest policy seems unworkable; given the international and entwined web of investors, labour and revenue, how can one even define a foreign film in this day and age? As time has taught us, there is always scope for a rollback from the Trump administration. However, while we may hope for such courage, we cannot be complacent or naive. I'm calling on the Commission and our Member States to act with urgency and seek the answers from the US on the policy over the coming days and weeks."
Tonino | Picula,S-D,EN,112744,,"Mr President, as the global order is under serious pressure, relations with our key ally are becoming one of the most important challenges we must address. It is clear that President Trump is using tariffs as a tool for blackmail. We must be prepared to respond to them equally. If he backs off, we can de-escalate, respecting our trade and digital services laws. It's not just about the trade in goods: when we add the exchange of services to the overall trade relationship, we almost reach an equilibrium. While politics on the other side of the Atlantic is currently arbitrary and transactional, the European Union must be a factor of global stability that conducts politics clearly and in a way that is based on facts. Moreover, this situation is an opportunity for the EU to take political responsibility, attract experts who share our values, and assume the global role because it has the democratic strength and economic capacity.","Mr President, as the global order is under serious pressure, relations with our key ally are becoming one of the most important challenges we must address. It is clear that President Trump is using tariffs as a tool for blackmail. We must be prepared to respond to them equally. If he backs off, we can de-escalate, respecting our trade and digital services laws. It's not just about the trade in goods: when we add the exchange of services to the overall trade relationship, we almost reach an equilibrium. While politics on the other side of the Atlantic is currently arbitrary and transactional, the European Union must be a factor of global stability that conducts politics clearly and in a way that is based on facts. Moreover, this situation is an opportunity for the EU to take political responsibility, attract experts who share our values, and assume the global role because it has the democratic strength and economic capacity."
Borja | Giménez Larraz,PPE,ES,125204,,"Señor presidente, la fuerza de Europa ante este desafío reside en su unión comercial. Somos un mercado decisivo a nivel global: 450 millones de personas con un alto poder adquisitivo. Tenemos el poder de hablarle de tú a tú a cualquiera –a Estados Unidos, también–. Esta guerra comercial no beneficia a nadie; a quien la ha empezado, tampoco. Debemos hacer valer nuestra unidad. Los Estados miembros no pueden caer en la trampa de hacer la guerra por su cuenta. Nuestros rivales comerciales nos quieren divididos. Por algo será. Negociemos hasta la extenuación con quien es nuestro principal socio comercial y aliado político, pero que sea consciente de que ante un ataque comercial tenemos herramientas y capacidad de respuesta. Y preparémosnos. Si Estados Unidos se repliega, busquemos nuevos mercados: ahí están México y Mercosur. Debemos cerrar más y mejores acuerdos. El libre comercio es un principio fundamental del proyecto europeo: influyamos a nivel global. Frente al repliegue nacional, frente al proteccionismo y los aranceles, más libre comercio basado en reglas y más Europa.","Mr. President, Europe's strength in the face of this challenge lies in its trade union. We are a decisive global market: 450 million people with high purchasing power. We have the power to talk on equal terms with anyone - the United States, too. This trade war is in no one's interest; it is in no one's interest who started it. We must assert our unity. Member states cannot fall into the trap of waging war on their own. Our trade rivals want us divided. There is a reason for that. Let us negotiate to the point of exhaustion with our main trading partner and political ally, but let them be aware that in the face of a trade attack we have the tools and the capacity to respond. And let us prepare ourselves. If the United States withdraws, let us look for new markets: there is Mexico and Mercosur. We must conclude more and better agreements. Free trade is a fundamental principle of the European project: let us influence at a global level. In the face of national withdrawal, in the face of protectionism and tariffs, more free trade based on rules and more Europe."
Aodhán | Ó Ríordáin,S-D,EN,257238,,"Mr President, 80 000 Irish jobs at risk. Last week, as we marked May Day, Trump's reckless tariffs cast a shadow over workers and businesses across Europe. The full impact is unclear, but what is clear is that unless we act, it's workers who will pay the price. We saw this in 2008, when families bore the brunt of the crash, and we can't let that happen again. We must protect those who keep our economies running: workers and small businesses. Real strength does not come from governments reneging on sick pay and living wage commitments, as the Irish Government has done, but from decent jobs, affordable housing and public investments. These tariffs are really about a perverse perception of power, and Europe must respond with unity and resolve. If Trump wants a trade war, we won't have started it, but we won't back down. This is our moment to prove that Europe is more than a market – indeed, it is a movement – and we are a Union of values, one that stands up for its people.","Mr President, 80 000 Irish jobs at risk. Last week, as we marked May Day, Trump's reckless tariffs cast a shadow over workers and businesses across Europe. The full impact is unclear, but what is clear is that unless we act, it's workers who will pay the price. We saw this in 2008, when families bore the brunt of the crash, and we can't let that happen again. We must protect those who keep our economies running: workers and small businesses. Real strength does not come from governments reneging on sick pay and living wage commitments, as the Irish Government has done, but from decent jobs, affordable housing and public investments. These tariffs are really about a perverse perception of power, and Europe must respond with unity and resolve. If Trump wants a trade war, we won't have started it, but we won't back down. This is our moment to prove that Europe is more than a market – indeed, it is a movement – and we are a Union of values, one that stands up for its people."
Michał | Wawrykiewicz,PPE,EN,257045,,"Mr President, Commissioner, colleagues, the United States is again turning to protectionism – an approach history has shown to hurt, not to help, citizens. Tariffs may look like a shield, but act like a sword, raising prices and limiting choices. Europe must not respond with isolation. Our strength is openness, competitiveness and fair trade partnerships. Instead of building walls, let's deepen ties with democratic allies, from Canada and Australia to Japan, and at the same time, maintain relations with the United States as much as economic profitability allows. Let's not allow others' short-term thinking to define our future. Free trade is not naive. It's in Europe's best interest.","Mr President, Commissioner, colleagues, the United States is again turning to protectionism – an approach history has shown to hurt, not to help, citizens. Tariffs may look like a shield, but act like a sword, raising prices and limiting choices. Europe must not respond with isolation. Our strength is openness, competitiveness and fair trade partnerships. Instead of building walls, let's deepen ties with democratic allies, from Canada and Australia to Japan, and at the same time, maintain relations with the United States as much as economic profitability allows. Let's not allow others' short-term thinking to define our future. Free trade is not naive. It's in Europe's best interest."
Nina | Carberry,PPE,EN,257296,,"Mr President, Commissioner, the EU and the US economic relationship is built on decades of cooperation and mutual success. However, when our industries, farmers and SMEs face unfair trade measures, Europe must respond. We are strongest when united. Acting together, we send a clear signal that we will not be divided or weakened by economic pressure. Our response must be twofold. We must look towards our own internal market. Europe must prioritise becoming more competitive, resilient and decisive. That means investing in innovation, cutting red tape and creating a genuine market for capital. And we must also look to new horizons, by securing new but fair trade agreements that open doors for our consumers and businesses. We have already proven that a united voice, a united Europe is the only way forward.","Mr President, Commissioner, the EU and the US economic relationship is built on decades of cooperation and mutual success. However, when our industries, farmers and SMEs face unfair trade measures, Europe must respond. We are strongest when united. Acting together, we send a clear signal that we will not be divided or weakened by economic pressure. Our response must be twofold. We must look towards our own internal market. Europe must prioritise becoming more competitive, resilient and decisive. That means investing in innovation, cutting red tape and creating a genuine market for capital. And we must also look to new horizons, by securing new but fair trade agreements that open doors for our consumers and businesses. We have already proven that a united voice, a united Europe is the only way forward."
Salvatore | De Meo,PPE,IT,204333,,"Signor Presidente, Signor Commissario, onorevoli colleghi, le recenti tensioni commerciali con gli Stati Uniti ci ricordano quanto sia fragile l'equilibrio economico globale e quanto sia necessaria, oggi più che mai, una voce europea forte, coesa e credibile. Di fronte a delle misure unilaterali che rischiano di colpire interi settori strategici della nostra economia, la risposta dell'Unione non può essere frammentata o esitante: deve basarsi sul dialogo e su una strategia chiara e condivisa. Dobbiamo rafforzare il mercato unico, rimuovere le barriere interne che ancora oggi ne limitano il suo potenziale e investire con determinazione nella nostra competitività industriale e tecnologica. Ma il vero obiettivo deve essere più ambizioso: costruire una partnership economica strutturata con gli Stati Uniti e con il Canada, con zero dazi, con un libero scambio equilibrato e regole comuni che tutelino imprese, lavoratori e consumatori. Non possiamo limitarci a inseguire le scelte altrui. L'Europa ha le carte in regola per essere protagonista nel commercio ma potrà farlo solo se parla con una sola voce,rafforza la propria autonomia strategica e agisce con coraggio e serietà e lungimiranza. Un'Europa forte non teme il confronto ma lo guida.","Mr. President, Commissioner, ladies and gentlemen, the recent trade tensions with the United States remind us how fragile the global economic balance is and how a strong, cohesive and credible European voice is needed now more than ever. Faced with unilateral measures that risk affecting entire strategic sectors of our economy, the Union's response cannot be fragmented or hesitant: it must be based on dialogue and a clear, shared strategy. We must strengthen the single market, remove the internal barriers that still limit its potential, and invest with determination in our industrial and technological competitiveness. But the real goal must be more ambitious: to build a structured economic partnership with the United States and Canada, with zero tariffs, balanced free trade and common rules that protect businesses, workers and consumers. We cannot just chase others' choices. Europe has what it takes to be a major player in trade but it will only be able to do so if it speaks with one voice,strengthens its strategic autonomy and acts with courage and seriousness and foresight. A strong Europe does not fear confrontation but leads it."
Carmen | Crespo Díaz,PPE,ES,257034,,"Señor presidente, señor comisario, señores diputados, los noventa días [de suspensión de la aplicación de contramedidas] nos dan un respiro. Yo creo que la Comisión Europea lo está haciendo bien. Está siendo flexible, pero también firme. Sabemos que la guerra comercial no beneficia a nadie, pero Estados Unidos no lo sabe a pesar de que se está resintiendo. En 2018, la situación era diferente, pero ahora disponemos de legislación que podemos aplicar. La política arancelaria tiene que tener constancia, seriedad y unión. Ni viajes inoportunos a China ni —por supuesto—, en este caso, una postura incondicional con Trump. La unidad de acción es fundamental. La retirada de los aranceles a la soja y al gas natural es un acierto, como también lo es la retirada del bourbon y del vino. El sector agroalimentario tiene que quedar al margen porque no aguanta, no tiene colchón. Los costes de producción son elevados. Como dicen el Informe Letta y el Informe Draghi, en estos momentos tenemos que tratar la simplificación en muchos sectores, entre ellos en el agroalimentario. Debemos garantizar la soberanía alimentaria para ser más resilientes. Sí a los acuerdos comerciales, pero evitando la competencia desleal.","Mr. President, Commissioner, ladies and gentlemen, the ninety days [of suspension of the application of countermeasures] give us some breathing space. I believe that the European Commission is doing well. It is being flexible, but also firm. We know that the trade war benefits no one, but the United States does not know that even though it is suffering. In 2018, the situation was different, but now we have legislation that we can implement. Tariff policy has to have consistency, seriousness and togetherness. Neither inopportune trips to China nor - of course - in this case, an unconditional stance with Trump. Unity of action is essential. The withdrawal of tariffs on soybeans and natural gas is a wise move, as is the withdrawal of bourbon and wine. The agri-food sector has to remain on the sidelines because it cannot stand it, it has no cushion. Production costs are high. As the Letta Report and the Draghi Report say, at the moment we have to deal with simplification in many sectors, including the agri-food sector. We must guarantee food sovereignty in order to be more resilient. Yes to trade agreements, but avoiding unfair competition."
